{
  "$schema": "https://json-schema.org/draft/2020-12/schema",
  "$id": "https://schemas.sistematech.local/esocial/v1/esocial-s-1050-sgp-request-dto-v1.schema.json",
  "title": "eSocial S-1050 SGP request DTO v1",
  "type": "object",
  "additionalProperties": false,
  "properties": {
    "eventClass": {
      "const": "S-1050"
    },
    "tenantId": {
      "type": "string",
      "minLength": 1
    },
    "sourceEventId": {
      "type": "string",
      "minLength": 1
    },
    "sourceEntityId": {
      "type": "string",
      "minLength": 1
    },
    "sourceEntityIds": {
      "type": "array",
      "items": {
        "type": "string",
        "minLength": 1
      }
    },
    "environment": {
      "enum": [
        "qualification",
        "restricted_production",
        "production"
      ]
    },
    "operation": {
      "enum": [
        "inclusion",
        "change",
        "rectification",
        "exclusion"
      ]
    },
    "employerCnpj": {
      "type": "string",
      "minLength": 1
    },
    "validityStart": {
      "type": "string",
      "minLength": 1
    },
    "validityEnd": {
      "type": "string",
      "minLength": 1
    },
    "workScheduleCode": {
      "type": "string",
      "minLength": 1
    },
    "description": {
      "type": "string",
      "minLength": 1
    },
    "dailyHours": {
      "anyOf": [
        {
          "type": "string",
          "minLength": 1
        },
        {
          "type": "number"
        }
      ]
    }
  },
  "required": [
    "eventClass",
    "tenantId",
    "sourceEventId",
    "sourceEntityId",
    "employerCnpj",
    "validityStart",
    "workScheduleCode",
    "description",
    "dailyHours"
  ],
  "not": {
    "anyOf": [
      {
        "required": [
          "xml"
        ]
      },
      {
        "required": [
          "payloadXml"
        ]
      },
      {
        "required": [
          "signedXml"
        ]
      },
      {
        "required": [
          "signedEnvelope"
        ]
      },
      {
        "required": [
          "pkcs7"
        ]
      },
      {
        "required": [
          "pkcs7Sha256"
        ]
      }
    ]
  }
}
